{"legislative_session": "2025", "identifier": "HB5950", "title": "AN ACT RELATING TO TOWNS AND CITIES -- GENERAL POWERS", "from_organization": "~{\"classification\": \"lower\"}", "classification": ["bill"], "subject": [], "abstracts": [{"note": "summary", "abstract": "Establishes a reimbursement system for a municipalities cost of training public safety personnel when they are hired by a different municipality or public safety agency within Rhode Island within 3 years of receiving the public safety training."}], "other_titles": [], "other_identifiers": [], "actions": [{"description": "02/28/2025 Introduced, referred to House Municipal Government & Housing", "date": "2025-02-28", "organization_id": "~{\"classification\": \"lower\"}", "classification": ["introduction", "referral-committee"], "related_entities": []}, {"description": "03/21/2025 Scheduled for hearing and/or consideration  (03/27/2025)", "date": "2025-03-21", "organization_id": "~{\"classification\": \"legislature\"}", "classification": [], "related_entities": []}, {"description": "03/27/2025 Committee recommended measure be held for further study", "date": "2025-03-27", "organization_id": "~{\"classification\": \"legislature\"}", "classification": ["committee-failure"], "related_entities": []}, {"description": "04/04/2025 Scheduled for consideration  (04/10/2025)", "date": "2025-04-04", "organization_id": "~{\"classification\": \"legislature\"}", "classification": [], "related_entities": []}, {"description": "04/10/2025 Committee recommends passage", "date": "2025-04-10", "organization_id": "~{\"classification\": \"legislature\"}", "classification": ["committee-passage-favorable"], "related_entities": []}, {"description": "04/25/2025 Placed on House Calendar  (04/29/2025)", "date": "2025-04-25", "organization_id": "~{\"classification\": \"lower\"}", "classification": ["reading-3"], "related_entities": []}, {"description": "04/29/2025 House passed as amended (floor amendment)", "date": "2025-04-29", "organization_id": "~{\"classification\": \"lower\"}", "classification": ["passage"], "related_entities": []}, {"description": "05/02/2025 Referred to Senate Housing and Municipal Government", "date": "2025-05-02", "organization_id": "~{\"classification\": \"upper\"}", "classification": ["referral-committee"], "related_entities": []}, {"description": "06/03/2025 Scheduled for consideration  (06/05/2025)", "date": "2025-06-03", "organization_id": "~{\"classification\": \"legislature\"}", "classification": [], "related_entities": []}, {"description": "06/05/2025 Committee recommends passage as amended in concurrence", "date": "2025-06-05", "organization_id": "~{\"classification\": \"legislature\"}", "classification": ["committee-passage-favorable"], "related_entities": []}, {"description": "06/06/2025 Placed on the Senate Consent Calendar  (06/10/2025)", "date": "2025-06-06", "organization_id": "~{\"classification\": \"upper\"}", "classification": ["reading-3"], "related_entities": []}, {"description": "06/10/2025 Senate passed as amended in concurrence", "date": "2025-06-10", "organization_id": "~{\"classification\": \"upper\"}", "classification": ["passage"], "related_entities": []}, {"description": "06/10/2025 Transmitted to Governor", "date": "2025-06-10", "organization_id": "~{\"classification\": \"executive\"}", "classification": ["executive-receipt"], "related_entities": []}, {"description": "06/13/2025 Signed by Governor", "date": "2025-06-13", "organization_id": "~{\"classification\": \"executive\"}", "classification": ["executive-signature"], "related_entities": []}], "sponsorships": [{"name": "Slater", "classification": "primary", "entity_type": "person", "primary": true, "person_id": "~{\"name\": \"Slater\"}", "organization_id": null}], "related_bills": [], "versions": [{"note": "5950\u00a0\u00a0as amended", "links": [{"url": "http://webserver.rilegislature.gov/BillText/BillText25/HouseText25/H5950aa.pdf", "media_type": "application/pdf"}], "date": "", "classification": ""}], "documents": [], "citations": [], "sources": [{"url": "https://status.rilegislature.gov/", "note": ""}], "extras": {}, "jurisdiction": {"id": "ocd-jurisdiction/country:us/state:ri/government", "name": "Rhode Island", "classification": "state", "division_id": "ocd-division/country:us/state:ri"}, "scraped_at": "2025-11-28T08:29:30+00:00", "_id": "5c305b84-cc34-11f0-bb6d-2230e9558571"}