{"legislative_session": "2025", "identifier": "SB487", "title": "AN ACT RELATING TO HEALTH AND SAFETY -- LICENSING OF HEALTHCARE FACILITIES", "from_organization": "~{\"classification\": \"upper\"}", "classification": ["bill"], "subject": [], "abstracts": [{"note": "summary", "abstract": "Prohibits any healthcare facility, from asking the legal immigration status of any patient."}], "other_titles": [], "other_identifiers": [], "actions": [{"description": "02/26/2025 Introduced, referred to Senate Health and Human Services", "date": "2025-02-26", "organization_id": "~{\"classification\": \"upper\"}", "classification": ["introduction", "referral-committee"], "related_entities": []}, {"description": "04/04/2025 Scheduled for hearing and/or consideration  (04/08/2025)", "date": "2025-04-04", "organization_id": "~{\"classification\": \"legislature\"}", "classification": [], "related_entities": []}, {"description": "04/08/2025 Committee recommended measure be held for further study", "date": "2025-04-08", "organization_id": "~{\"classification\": \"legislature\"}", "classification": ["committee-failure"], "related_entities": []}, {"description": "05/30/2025 Scheduled for consideration  (06/02/2025)", "date": "2025-05-30", "organization_id": "~{\"classification\": \"legislature\"}", "classification": [], "related_entities": []}, {"description": "05/30/2025 Proposed Substitute", "date": "2025-05-30", "organization_id": "~{\"classification\": \"legislature\"}", "classification": ["substitution"], "related_entities": []}, {"description": "06/02/2025 Committee recommends passage of Sub A", "date": "2025-06-02", "organization_id": "~{\"classification\": \"legislature\"}", "classification": ["committee-passage-favorable"], "related_entities": []}, {"description": "06/02/2025 Placed on Senate Calendar  (06/04/2025)", "date": "2025-06-02", "organization_id": "~{\"classification\": \"upper\"}", "classification": ["reading-3"], "related_entities": []}, {"description": "06/04/2025 Senate passed Sub A", "date": "2025-06-04", "organization_id": "~{\"classification\": \"upper\"}", "classification": ["passage"], "related_entities": []}, {"description": "06/18/2025 Placed on House Calendar  (06/20/2025)", "date": "2025-06-18", "organization_id": "~{\"classification\": \"lower\"}", "classification": ["reading-3"], "related_entities": []}, {"description": "06/20/2025 House passed Sub A in concurrence", "date": "2025-06-20", "organization_id": "~{\"classification\": \"lower\"}", "classification": ["passage"], "related_entities": []}, {"description": "06/25/2025 Transmitted to Governor", "date": "2025-06-25", "organization_id": "~{\"classification\": \"executive\"}", "classification": ["executive-receipt"], "related_entities": []}, {"description": "07/01/2025 Signed by Governor", "date": "2025-07-01", "organization_id": "~{\"classification\": \"executive\"}", "classification": ["executive-signature"], "related_entities": []}], "sponsorships": [{"name": "Lauria", "classification": "primary", "entity_type": "person", "primary": true, "person_id": "~{\"name\": \"Lauria\"}", "organization_id": null}, {"name": "Acosta", "classification": "primary", "entity_type": "person", "primary": true, "person_id": "~{\"name\": \"Acosta\"}", "organization_id": null}, {"name": "Quezada", "classification": "primary", "entity_type": "person", "primary": true, "person_id": "~{\"name\": \"Quezada\"}", "organization_id": null}, {"name": "Vargas", "classification": "primary", "entity_type": "person", "primary": true, "person_id": "~{\"name\": \"Vargas\"}", "organization_id": null}, {"name": "Lawson", "classification": "primary", "entity_type": "person", "primary": true, "person_id": "~{\"name\": \"Lawson\"}", "organization_id": null}, {"name": "Mack", "classification": "primary", "entity_type": "person", "primary": true, "person_id": "~{\"name\": \"Mack\"}", "organization_id": null}, {"name": "DiMario", "classification": "primary", "entity_type": "person", "primary": true, "person_id": "~{\"name\": \"DiMario\"}", "organization_id": null}, {"name": "Euer", "classification": "primary", "entity_type": "person", "primary": true, "person_id": "~{\"name\": \"Euer\"}", "organization_id": null}, {"name": "Pearson", "classification": "primary", "entity_type": "person", "primary": true, "person_id": "~{\"name\": \"Pearson\"}", "organization_id": null}, {"name": "Ujifusa", "classification": "primary", "entity_type": "person", "primary": true, "person_id": "~{\"name\": \"Ujifusa\"}", "organization_id": null}], "related_bills": [], "versions": [{"note": "487\u00a0 SUB A", "links": [{"url": "http://webserver.rilegislature.gov/BillText/BillText25/SenateText25/S0487A.pdf", "media_type": "application/pdf"}], "date": "", "classification": ""}], "documents": [], "citations": [], "sources": [{"url": "https://status.rilegislature.gov/", "note": ""}], "extras": {}, "jurisdiction": {"id": "ocd-jurisdiction/country:us/state:ri/government", "name": "Rhode Island", "classification": "state", "division_id": "ocd-division/country:us/state:ri"}, "scraped_at": "2026-01-05T08:35:55+00:00", "_id": "8d2ce84c-ea11-11f0-a1b3-de3d76deeb27"}