{"legislative_session": "2025", "identifier": "HB6208", "title": "AN ACT RELATING TO HEALTH AND SAFETY -- HAZARDOUS WASTE MANAGEMENT", "from_organization": "~{\"classification\": \"lower\"}", "classification": ["bill"], "subject": [], "abstracts": [{"note": "summary", "abstract": "Strikes the words \"which is naturally occurring\" with regard to any promulgated rules and regulations of the department of environmental management (DEM) relating to the remediation of arsenic."}], "other_titles": [], "other_identifiers": [], "actions": [{"description": "04/09/2025 Introduced, referred to House Environment and Natural Resources", "date": "2025-04-09", "organization_id": "~{\"classification\": \"lower\"}", "classification": ["introduction", "referral-committee"], "related_entities": []}, {"description": "05/09/2025 Scheduled for hearing and/or consideration  (05/13/2025)", "date": "2025-05-09", "organization_id": "~{\"classification\": \"legislature\"}", "classification": [], "related_entities": []}, {"description": "05/13/2025 Committee recommended measure be held for further study", "date": "2025-05-13", "organization_id": "~{\"classification\": \"legislature\"}", "classification": ["committee-failure"], "related_entities": []}, {"description": "05/23/2025 Scheduled for consideration  (05/29/2025)", "date": "2025-05-23", "organization_id": "~{\"classification\": \"legislature\"}", "classification": [], "related_entities": []}, {"description": "05/29/2025 Committee recommends passage", "date": "2025-05-29", "organization_id": "~{\"classification\": \"legislature\"}", "classification": ["committee-passage-favorable"], "related_entities": []}, {"description": "06/06/2025 Placed on House Calendar  (06/12/2025)", "date": "2025-06-06", "organization_id": "~{\"classification\": \"lower\"}", "classification": ["reading-3"], "related_entities": []}, {"description": "06/12/2025 House read and passed", "date": "2025-06-12", "organization_id": "~{\"classification\": \"lower\"}", "classification": ["passage"], "related_entities": []}, {"description": "06/13/2025 Placed on the Senate Consent Calendar  (06/18/2025)", "date": "2025-06-13", "organization_id": "~{\"classification\": \"upper\"}", "classification": ["reading-3"], "related_entities": []}, {"description": "06/18/2025 Senate passed in concurrence", "date": "2025-06-18", "organization_id": "~{\"classification\": \"upper\"}", "classification": ["passage"], "related_entities": []}, {"description": "06/18/2025 Transmitted to Governor", "date": "2025-06-18", "organization_id": "~{\"classification\": \"executive\"}", "classification": ["executive-receipt"], "related_entities": []}, {"description": "06/24/2025 Signed by Governor", "date": "2025-06-24", "organization_id": "~{\"classification\": \"executive\"}", "classification": ["executive-signature"], "related_entities": []}], "sponsorships": [{"name": "Cortvriend", "classification": "primary", "entity_type": "person", "primary": true, "person_id": "~{\"name\": \"Cortvriend\"}", "organization_id": null}], "related_bills": [], "versions": [{"note": "6208", "links": [{"url": "http://webserver.rilegislature.gov/BillText/BillText25/HouseText25/H6208.pdf", "media_type": "application/pdf"}], "date": "", "classification": ""}], "documents": [], "citations": [], "sources": [{"url": "https://status.rilegislature.gov/", "note": ""}], "extras": {}, "jurisdiction": {"id": "ocd-jurisdiction/country:us/state:ri/government", "name": "Rhode Island", "classification": "state", "division_id": "ocd-division/country:us/state:ri"}, "scraped_at": "2025-12-31T08:31:28+00:00", "_id": "1a102064-e623-11f0-b42a-1605a2255659"}