{"legislative_session": "2025", "identifier": "SB302", "title": "AN ACT RELATING TO LABOR AND LABOR RELATIONS -- RHODE ISLAND NONCOMPETITION AGREEMENT ACT", "from_organization": "~{\"classification\": \"upper\"}", "classification": ["bill"], "subject": [], "abstracts": [{"note": "summary", "abstract": "Prohibits noncompete agreements except for noncompete agreements between a seller and buyer of a business; creates civil action for an employer for the violation of an agreement by employee regarding disclosure or wrongful utilization of trade secrets."}], "other_titles": [], "other_identifiers": [], "actions": [{"description": "02/13/2025 Introduced, referred to Senate Judiciary", "date": "2025-02-13", "organization_id": "~{\"classification\": \"upper\"}", "classification": ["introduction", "referral-committee"], "related_entities": []}, {"description": "05/19/2025 Scheduled for hearing and/or consideration  (05/22/2025)", "date": "2025-05-19", "organization_id": "~{\"classification\": \"legislature\"}", "classification": [], "related_entities": []}, {"description": "05/22/2025 Committee recommended measure be held for further study", "date": "2025-05-22", "organization_id": "~{\"classification\": \"legislature\"}", "classification": ["committee-failure"], "related_entities": []}, {"description": "06/06/2025 Scheduled for consideration", "date": "2025-06-06", "organization_id": "~{\"classification\": \"legislature\"}", "classification": [], "related_entities": []}, {"description": "06/10/2025 Meeting postponed  (06/10/2025)", "date": "2025-06-10", "organization_id": "~{\"classification\": \"legislature\"}", "classification": [], "related_entities": []}, {"description": "06/09/2025 Proposed Substitute", "date": "2025-06-09", "organization_id": "~{\"classification\": \"legislature\"}", "classification": ["substitution"], "related_entities": []}, {"description": "06/10/2025 Meeting postponed  (06/10/2025)", "date": "2025-06-10", "organization_id": "~{\"classification\": \"legislature\"}", "classification": [], "related_entities": []}, {"description": "06/10/2025 Scheduled for consideration  (06/12/2025)", "date": "2025-06-10", "organization_id": "~{\"classification\": \"legislature\"}", "classification": [], "related_entities": []}, {"description": "06/11/2025 Proposed Substitute", "date": "2025-06-11", "organization_id": "~{\"classification\": \"legislature\"}", "classification": ["substitution"], "related_entities": []}, {"description": "06/12/2025 Committee recommends passage of Sub A", "date": "2025-06-12", "organization_id": "~{\"classification\": \"legislature\"}", "classification": ["committee-passage-favorable"], "related_entities": []}, {"description": "06/13/2025 Placed on Senate Calendar  (06/18/2025)", "date": "2025-06-13", "organization_id": "~{\"classification\": \"upper\"}", "classification": ["reading-3"], "related_entities": []}, {"description": "06/18/2025 Senate passed Sub A as amended (floor amendment)", "date": "2025-06-18", "organization_id": "~{\"classification\": \"upper\"}", "classification": ["passage"], "related_entities": []}], "sponsorships": [{"name": "LaMountain", "classification": "primary", "entity_type": "person", "primary": true, "person_id": "~{\"name\": \"LaMountain\"}", "organization_id": null}], "related_bills": [], "versions": [{"note": "302\u00a0 SUB A\u00a0as amended", "links": [{"url": "http://webserver.rilegislature.gov/BillText/BillText25/SenateText25/S0302Aaa.pdf", "media_type": "application/pdf"}], "date": "", "classification": ""}], "documents": [], "citations": [], "sources": [{"url": "https://status.rilegislature.gov/", "note": ""}], "extras": {}, "jurisdiction": {"id": "ocd-jurisdiction/country:us/state:ri/government", "name": "Rhode Island", "classification": "state", "division_id": "ocd-division/country:us/state:ri"}, "scraped_at": "2025-11-28T08:29:13+00:00", "_id": "52197414-cc34-11f0-bb6d-2230e9558571"}