{"legislative_session": "2025", "identifier": "HB5730", "title": "AN ACT RELATING TO MOTOR AND OTHER VEHICLES -- SIZE, WEIGHT, AND LOAD LIMITS", "from_organization": "~{\"classification\": \"lower\"}", "classification": ["bill"], "subject": [], "abstracts": [{"note": "summary", "abstract": "Includes boats and marine-related assets in the blanket permit available for overweight or over-dimensional vehicles."}], "other_titles": [], "other_identifiers": [], "actions": [{"description": "02/26/2025 Introduced, referred to House State Government & Elections", "date": "2025-02-26", "organization_id": "~{\"classification\": \"lower\"}", "classification": ["introduction", "referral-committee"], "related_entities": []}, {"description": "03/07/2025 Scheduled for hearing and/or consideration  (03/13/2025)", "date": "2025-03-07", "organization_id": "~{\"classification\": \"legislature\"}", "classification": [], "related_entities": []}, {"description": "03/13/2025 Committee recommended measure be held for further study", "date": "2025-03-13", "organization_id": "~{\"classification\": \"legislature\"}", "classification": ["committee-failure"], "related_entities": []}, {"description": "04/25/2025 Scheduled for consideration  (04/29/2025)", "date": "2025-04-25", "organization_id": "~{\"classification\": \"legislature\"}", "classification": [], "related_entities": []}, {"description": "04/25/2025 Proposed Substitute", "date": "2025-04-25", "organization_id": "~{\"classification\": \"legislature\"}", "classification": ["substitution"], "related_entities": []}, {"description": "04/29/2025 Committee recommends passage of Sub A", "date": "2025-04-29", "organization_id": "~{\"classification\": \"legislature\"}", "classification": ["committee-passage-favorable"], "related_entities": []}, {"description": "05/09/2025 Placed on House Calendar  (05/13/2025)", "date": "2025-05-09", "organization_id": "~{\"classification\": \"lower\"}", "classification": ["reading-3"], "related_entities": []}, {"description": "05/13/2025 House passed Sub A", "date": "2025-05-13", "organization_id": "~{\"classification\": \"lower\"}", "classification": ["passage"], "related_entities": []}, {"description": "05/23/2025 Referred to Senate Judiciary", "date": "2025-05-23", "organization_id": "~{\"classification\": \"upper\"}", "classification": ["referral-committee"], "related_entities": []}, {"description": "05/23/2025 Scheduled for consideration  (05/27/2025)", "date": "2025-05-23", "organization_id": "~{\"classification\": \"legislature\"}", "classification": [], "related_entities": []}, {"description": "05/27/2025 Committee recommends passage of Sub A in concurrence", "date": "2025-05-27", "organization_id": "~{\"classification\": \"legislature\"}", "classification": ["committee-passage-favorable"], "related_entities": []}, {"description": "05/30/2025 Placed on the Senate Consent Calendar  (06/05/2025)", "date": "2025-05-30", "organization_id": "~{\"classification\": \"upper\"}", "classification": ["reading-3"], "related_entities": []}, {"description": "06/05/2025 Senate passed Sub A in concurrence", "date": "2025-06-05", "organization_id": "~{\"classification\": \"upper\"}", "classification": ["passage"], "related_entities": []}, {"description": "06/05/2025 Transmitted to Governor", "date": "2025-06-05", "organization_id": "~{\"classification\": \"executive\"}", "classification": ["executive-receipt"], "related_entities": []}, {"description": "06/10/2025 Signed by Governor", "date": "2025-06-10", "organization_id": "~{\"classification\": \"executive\"}", "classification": ["executive-signature"], "related_entities": []}], "sponsorships": [{"name": "Speakman", "classification": "primary", "entity_type": "person", "primary": true, "person_id": "~{\"name\": \"Speakman\"}", "organization_id": null}, {"name": "Boylan", "classification": "primary", "entity_type": "person", "primary": true, "person_id": "~{\"name\": \"Boylan\"}", "organization_id": null}, {"name": "Cortvriend", "classification": "primary", "entity_type": "person", "primary": true, "person_id": "~{\"name\": \"Cortvriend\"}", "organization_id": null}, {"name": "Edwards", "classification": "primary", "entity_type": "person", "primary": true, "person_id": "~{\"name\": \"Edwards\"}", "organization_id": null}, {"name": "Casey", "classification": "primary", "entity_type": "person", "primary": true, "person_id": "~{\"name\": \"Casey\"}", "organization_id": null}], "related_bills": [], "versions": [{"note": "5730\u00a0 SUB A", "links": [{"url": "http://webserver.rilegislature.gov/BillText/BillText25/HouseText25/H5730A.pdf", "media_type": "application/pdf"}], "date": "", "classification": ""}], "documents": [], "citations": [], "sources": [{"url": "https://status.rilegislature.gov/", "note": ""}], "extras": {}, "jurisdiction": {"id": "ocd-jurisdiction/country:us/state:ri/government", "name": "Rhode Island", "classification": "state", "division_id": "ocd-division/country:us/state:ri"}, "scraped_at": "2025-11-30T08:24:41+00:00", "_id": "0504b542-cdc6-11f0-93c0-5eadc00ba1ed"}