{"legislative_session": "2025", "identifier": "HB5569", "title": "AN ACT RELATING TO INSURANCE -- PET INSURANCE ACT", "from_organization": "~{\"classification\": \"lower\"}", "classification": ["bill"], "subject": [], "abstracts": [{"note": "summary", "abstract": "Provides for the sale and regulation of pet insurance."}], "other_titles": [], "other_identifiers": [], "actions": [{"description": "02/26/2025 Introduced, referred to House Corporations", "date": "2025-02-26", "organization_id": "~{\"classification\": \"lower\"}", "classification": ["introduction", "referral-committee"], "related_entities": []}, {"description": "03/07/2025 Scheduled for hearing and/or consideration  (03/13/2025)", "date": "2025-03-07", "organization_id": "~{\"classification\": \"legislature\"}", "classification": [], "related_entities": []}, {"description": "03/13/2025 Committee recommended measure be held for further study", "date": "2025-03-13", "organization_id": "~{\"classification\": \"legislature\"}", "classification": ["committee-failure"], "related_entities": []}, {"description": "03/21/2025 Scheduled for consideration  (03/25/2025)", "date": "2025-03-21", "organization_id": "~{\"classification\": \"legislature\"}", "classification": [], "related_entities": []}, {"description": "03/21/2025 Proposed Substitute", "date": "2025-03-21", "organization_id": "~{\"classification\": \"legislature\"}", "classification": ["substitution"], "related_entities": []}, {"description": "03/25/2025 Committee recommends passage of Sub A", "date": "2025-03-25", "organization_id": "~{\"classification\": \"legislature\"}", "classification": ["committee-passage-favorable"], "related_entities": []}, {"description": "04/04/2025 Placed on House Calendar  (04/08/2025)", "date": "2025-04-04", "organization_id": "~{\"classification\": \"lower\"}", "classification": ["reading-3"], "related_entities": []}, {"description": "04/08/2025 House passed Sub A", "date": "2025-04-08", "organization_id": "~{\"classification\": \"lower\"}", "classification": ["passage"], "related_entities": []}, {"description": "05/02/2025 Referred to Senate Environment and Agriculture", "date": "2025-05-02", "organization_id": "~{\"classification\": \"upper\"}", "classification": ["referral-committee"], "related_entities": []}, {"description": "06/13/2025 Scheduled for consideration  (06/17/2025)", "date": "2025-06-13", "organization_id": "~{\"classification\": \"legislature\"}", "classification": [], "related_entities": []}, {"description": "06/17/2025 Committee recommends passage of Sub A in concurrence", "date": "2025-06-17", "organization_id": "~{\"classification\": \"legislature\"}", "classification": ["committee-passage-favorable"], "related_entities": []}, {"description": "06/18/2025 Placed on the Senate Consent Calendar  (06/20/2025)", "date": "2025-06-18", "organization_id": "~{\"classification\": \"upper\"}", "classification": ["reading-3"], "related_entities": []}, {"description": "06/20/2025 Senate passed Sub A in concurrence", "date": "2025-06-20", "organization_id": "~{\"classification\": \"upper\"}", "classification": ["passage"], "related_entities": []}, {"description": "06/27/2025 Transmitted to Governor", "date": "2025-06-27", "organization_id": "~{\"classification\": \"executive\"}", "classification": ["executive-receipt"], "related_entities": []}, {"description": "07/02/2025 Signed by Governor", "date": "2025-07-02", "organization_id": "~{\"classification\": \"executive\"}", "classification": ["executive-signature"], "related_entities": []}], "sponsorships": [{"name": "Solomon", "classification": "primary", "entity_type": "person", "primary": true, "person_id": "~{\"name\": \"Solomon\"}", "organization_id": null}], "related_bills": [], "versions": [{"note": "5569\u00a0 SUB A", "links": [{"url": "http://webserver.rilegislature.gov/BillText/BillText25/HouseText25/H5569A.pdf", "media_type": "application/pdf"}], "date": "", "classification": ""}], "documents": [], "citations": [], "sources": [{"url": "https://status.rilegislature.gov/", "note": ""}], "extras": {}, "jurisdiction": {"id": "ocd-jurisdiction/country:us/state:ri/government", "name": "Rhode Island", "classification": "state", "division_id": "ocd-division/country:us/state:ri"}, "scraped_at": "2025-12-14T23:34:38+00:00", "_id": "74cf2a62-d945-11f0-a294-5226946d5c57"}