{"legislative_session": "2025", "identifier": "HB5436", "title": "AN ACT RELATING TO CRIMINAL OFFENSES -- RHODE ISLAND ASSAULT WEAPONS BAN ACT OF 2025", "from_organization": "~{\"classification\": \"lower\"}", "classification": ["bill"], "subject": [], "abstracts": [{"note": "summary", "abstract": "Establishes the Rhode Island Assault Weapons Ban Act of 2025."}], "other_titles": [], "other_identifiers": [], "actions": [{"description": "02/12/2025 Introduced, referred to House Judiciary", "date": "2025-02-12", "organization_id": "~{\"classification\": \"lower\"}", "classification": ["introduction", "referral-committee"], "related_entities": []}, {"description": "03/12/2025 Scheduled for hearing and/or consideration  (03/26/2025)", "date": "2025-03-12", "organization_id": "~{\"classification\": \"legislature\"}", "classification": [], "related_entities": []}, {"description": "03/26/2025 Committee recommended measure be held for further study", "date": "2025-03-26", "organization_id": "~{\"classification\": \"legislature\"}", "classification": ["committee-failure"], "related_entities": []}, {"description": "05/30/2025 Scheduled for consideration  (06/03/2025)", "date": "2025-05-30", "organization_id": "~{\"classification\": \"legislature\"}", "classification": [], "related_entities": []}, {"description": "05/30/2025 Proposed Substitute", "date": "2025-05-30", "organization_id": "~{\"classification\": \"legislature\"}", "classification": ["substitution"], "related_entities": []}, {"description": "06/03/2025 Committee recommends passage of Sub A", "date": "2025-06-03", "organization_id": "~{\"classification\": \"legislature\"}", "classification": ["committee-passage-favorable"], "related_entities": []}, {"description": "06/03/2025 Placed on House Calendar  (06/05/2025)", "date": "2025-06-03", "organization_id": "~{\"classification\": \"lower\"}", "classification": ["reading-3"], "related_entities": []}, {"description": "06/05/2025 House passed Sub A", "date": "2025-06-05", "organization_id": "~{\"classification\": \"lower\"}", "classification": ["passage"], "related_entities": []}, {"description": "06/11/2025 Referred to Senate Judiciary", "date": "2025-06-11", "organization_id": "~{\"classification\": \"upper\"}", "classification": ["referral-committee"], "related_entities": []}, {"description": "06/16/2025 Scheduled for consideration  (06/18/2025)", "date": "2025-06-16", "organization_id": "~{\"classification\": \"legislature\"}", "classification": [], "related_entities": []}, {"description": "06/17/2025 Proposed Substitute", "date": "2025-06-17", "organization_id": "~{\"classification\": \"legislature\"}", "classification": ["substitution"], "related_entities": []}, {"description": "06/18/2025 Committee recommended Substitute A be held for further study", "date": "2025-06-18", "organization_id": "~{\"classification\": \"legislature\"}", "classification": ["substitution"], "related_entities": []}], "sponsorships": [{"name": "Knight", "classification": "primary", "entity_type": "person", "primary": true, "person_id": "~{\"name\": \"Knight\"}", "organization_id": null}, {"name": "Caldwell", "classification": "primary", "entity_type": "person", "primary": true, "person_id": "~{\"name\": \"Caldwell\"}", "organization_id": null}, {"name": "Boylan", "classification": "primary", "entity_type": "person", "primary": true, "person_id": "~{\"name\": \"Boylan\"}", "organization_id": null}, {"name": "Speakman", "classification": "primary", "entity_type": "person", "primary": true, "person_id": "~{\"name\": \"Speakman\"}", "organization_id": null}, {"name": "McEntee", "classification": "primary", "entity_type": "person", "primary": true, "person_id": "~{\"name\": \"McEntee\"}", "organization_id": null}, {"name": "Ajello", "classification": "primary", "entity_type": "person", "primary": true, "person_id": "~{\"name\": \"Ajello\"}", "organization_id": null}, {"name": "Kazarian", "classification": "primary", "entity_type": "person", "primary": true, "person_id": "~{\"name\": \"Kazarian\"}", "organization_id": null}, {"name": "Craven", "classification": "primary", "entity_type": "person", "primary": true, "person_id": "~{\"name\": \"Craven\"}", "organization_id": null}, {"name": "Dawson", "classification": "primary", "entity_type": "person", "primary": true, "person_id": "~{\"name\": \"Dawson\"}", "organization_id": null}, {"name": "Felix", "classification": "primary", "entity_type": "person", "primary": true, "person_id": "~{\"name\": \"Felix\"}", "organization_id": null}], "related_bills": [], "versions": [{"note": "5436\u00a0 SUB A", "links": [{"url": "http://webserver.rilegislature.gov/BillText/BillText25/HouseText25/H5436A.pdf", "media_type": "application/pdf"}], "date": "", "classification": ""}], "documents": [], "citations": [], "sources": [{"url": "https://status.rilegislature.gov/", "note": ""}], "extras": {}, "jurisdiction": {"id": "ocd-jurisdiction/country:us/state:ri/government", "name": "Rhode Island", "classification": "state", "division_id": "ocd-division/country:us/state:ri"}, "scraped_at": "2025-12-23T08:31:56+00:00", "_id": "d7c46cd2-dfd9-11f0-83e2-ea58985922a2"}